time,tweet
2018-08-31 14:07:38,@Mathieu_Kl Il faisait simplement une petite promenade de santé 😉
2018-08-31 13:24:56,[#RATPSTORIES] Aperçu cette nuit sur la #Ligne8 et la #Ligne13 📸 https://t.co/VbZf7Z4U8x
2018-08-31 10:18:47,"@RomDaignault La photo a été prise près de la station Créteil- l'Echat, non loin de l'hôpital Henri Mondor effectivement !"
2018-08-31 09:15:07,[#archivesRATP] Il y a 40 ans jour pour jour ... 📸#RATP https://t.co/PmONsFGpyi
2018-08-31 09:13:25,@Jon_CC_R La photo date du 11 juillet 1978 😉
2018-08-30 14:24:58,[#JeudiPhoto 📸] Fondu dans le décor ... #RATP https://t.co/rhQcUaYNwf
2018-08-23 10:15:09,"[#LeSaviezVous ?] En 1970, le mât M jaune a été créé. Bien visible, cette lettre lumineuse accompagne les entourage… https://t.co/lqsCLAKWHr"
2018-08-21 09:40:17,"@lioneldeveaux Bonjour, aucun incident n'a été signalé à cette station si ce n'est un enfant égaré. Le trafic est n… https://t.co/EbqYPvmOB5"
2018-08-18 12:17:29,"14:16, le trafic est rétabli sur la ligne (Personnes sur les voies)  #RATP #ligne8"
2018-08-18 11:59:29,"13:58, le trafic reprend progressivement sur la ligne (Personnes sur les voies)  #RATP #ligne8"
2018-08-18 11:50:29,"13:49, le trafic est interrompu entre Concorde et Republique. Reprise estimée à 14:10. (Personnes sur les voies)  #RATP #ligne8"
2018-08-18 07:18:31,"09:17, le trafic est rétabli sur la ligne (panne de signalisation)  #RATP #ligne8"
2018-08-18 06:02:30,"08:01, le trafic est perturbé sur la ligne (panne de signalisation)  #RATP #ligne8"
2018-08-18 05:26:30,"07:25, le trafic est perturbé entre Maisons-Alfort-Les Juilliottes et Pointe du Lac (panne de signalisation)  #RATP #ligne8"
2018-08-16 18:44:38,"@Clement673 Bonsoir, hélas non c'était juste un train qui allait garer. Très bonne soirée. Vivi"
2018-08-16 11:41:06,"@SR_Lou_94 Bonjour Lou, navré pour ce manque d'infos, visiblement du à un acte de vandalisme. Je transmets votre ré… https://t.co/AL56ik8WJl"
2018-08-16 11:31:54,"@PLACCESS Bjr Louis, Désolé pour ces nuisances sonores. Il est vrai que si la coupure du moteur est la règle en ter… https://t.co/f78J9vp01s"
2018-08-16 09:30:35,"11:28, le trafic est rétabli sur la ligne (incident voie)  #RATP #ligne8"
2018-08-16 09:09:31,"11:08, le trafic est perturbé sur la ligne (incident voie)  #RATP #ligne8"
2018-08-16 08:54:49,"10:52, le trafic reste normalement interrompu entre Maisons-Alfort-Les Juilliottes et Créteil-Pointe du Lac  suite… https://t.co/GyRyLpYWzZ"
2018-08-16 08:50:30,"10:49, le trafic reprend progressivement entre Reuilly-Did. et Maisons-Alfort-Les Juilliottes (incident voie)  #RATP #ligne8"
2018-08-16 08:47:01,"10:44, trafic interrompu entre Reuilly-Did. et Pointe du Lac.  Les mainteneurs sont en intervention sur les voies.… https://t.co/WkvgmPM7Bq"
2018-08-16 08:43:29,"10:42, le trafic est interrompu entre Reuilly-Did. et Pointe du Lac. Reprise estimée à 11:00. (incident voie)  #RATP #ligne8"
2018-08-16 08:02:03,"10:01, le trafic est perturbé sur la ligne. L'incident à la voie occasionne des ralentissement entre Porte Dorée et… https://t.co/3itSvnPzjk"
2018-08-16 07:58:29,"09:57, le trafic est perturbé sur la ligne (incident voie)  #RATP #ligne8"
2018-08-14 13:55:56,[#Travaux #Ligne8] Opération de grutage réussie ! Les équipes #RATP sont à pied d'œuvre et continuent les travaux 💪… https://t.co/iRnpSaE94F
2018-08-13 19:20:05,"@Clement673 @olaurent084 @GdParisExpress Bonsoir, je suis désolée voici qui pourrait vous aider. Bonne soirée. Vivi https://t.co/ePsGvFQ9RA"
2018-08-13 10:16:43,[#Travaux #Ligne8] 👀Découvrez en images l'explication de l'opération de grutage du passage sous voies qui servira d… https://t.co/pcuVB2oMls
2018-08-13 03:20:04,"Travaux en cours sur #ligne8 jusqu'au 18/08/2018 02:30. Pour plus d'informations, https://t.co/f37aSMWn2d"
2018-08-12 10:00:06,"Travaux prévus sur #ligne8 du 13/08/2018 05:20 au 18/08/2018 02:30. Pour plus d'informations, https://t.co/f37aSMWn2d"
2018-08-12 09:33:48,@olaurent084 @GdParisExpress Voici les informations que vous attendiez avec les plans et horaires des bus. Voir sur… https://t.co/mNTzIZxyQp
2018-08-12 08:29:57,"@olaurent084 @GdParisExpress Bonjour, je me renseigne pour vous donner une adresse précise, en attendant voici un l… https://t.co/OCFrmcLBVO"
2018-08-09 21:16:30,"23:15, le trafic est rétabli sur la ligne (incident voie)  #RATP #ligne8"
2018-08-09 19:56:28,"21:55, le trafic reprend progressivement sur la ligne (incident voie)  #RATP #ligne8"
2018-08-09 19:41:28,"21:40, le trafic est interrompu entre Pte de Charenton et Pointe du Lac. Reprise estimée à 22:00. (incident voie)  #RATP #ligne8"
2018-08-08 19:01:59,"21:00, le trafic est rétabli sur la ligne (panne de signalisation)  #RATP #ligne8"
2018-08-08 18:42:28,"20:40, le trafic est perturbé sur la ligne (panne de signalisation)  #RATP #ligne8"
2018-08-08 15:03:30,"17:02, le trafic est rétabli sur la ligne (incident technique)  #RATP #ligne8"
2018-08-08 14:53:29,"16:52, le trafic est perturbé sur la ligne (incident technique)  #RATP #ligne8"
2018-08-08 14:23:29,"16:22, le trafic reprend progressivement entre Tour-Maubourg et Opera (incident technique)  #RATP #ligne8"
2018-08-08 14:21:30,"16:19, le trafic est interrompu entre Tour-Maubourg et Opera. Reprise estimée à 16:25. (incident technique)  #RATP #ligne8"
2018-08-08 13:10:30,"15:08, le trafic est rétabli sur la ligne (incident technique)  #RATP #ligne8"
2018-08-08 12:56:29,"14:55, le trafic est perturbé entre La Motte-Picquet-Grenelle et Republique (incident technique)  #RATP #ligne8"
2018-08-08 10:54:31,"12:53, le trafic est rétabli sur la ligne (intervention des équipes techniques)  #RATP #ligne8"
2018-08-08 10:51:29,"12:50, le trafic est perturbé sur la ligne (intervention des équipes techniques)  #RATP #ligne8"
2018-08-08 10:44:30,"12:43, le trafic reprend progressivement sur la ligne (intervention des équipes techniques)  #RATP #ligne8"
2018-08-08 10:36:32,"12:35, le trafic est interrompu entre La Motte-Picquet-Grenelle et Republique. Reprise estimée à 12:45. (interventi… https://t.co/n2CCQfZRXb"
2018-08-08 10:06:56,"12:04, le trafic est rétabli sur la ligne (panne de signalisation)  #RATP #ligne8"
2018-08-08 09:52:28,"11:51, le trafic est perturbé sur la ligne (panne de signalisation)  #RATP #ligne8"
2018-08-08 09:40:17,Une panne de signalisation ne permet pas la continuité du trafic en direction de Pointe du Lac à partir de Concorde… https://t.co/OAN8OPdFze
2018-08-08 09:31:29,"11:30, la rame stationne à Concorde en dir. de Pointe du Lac (panne de signalisation)  #RATP #ligne8"
2018-08-08 09:06:46,"Et pour absorber l’augmentation attendue du nombre de voyageurs sur la #ligne8, les espaces de la station Créteil-L… https://t.co/BTAADR3Kip"
2018-08-08 09:06:45,"6 modules vont ainsi être déplacés sous la voie par une grue, et grâce à une mobilisation exceptionnelle sur le cha… https://t.co/MEcxqaLogx"
2018-08-08 09:06:45,"D’ici fin 2022, la ligne 8 sera en correspondance avec la nouvelle ligne 15 Sud à la station Créteil-L’Échat. Un pa… https://t.co/PMPJg0GiEp"
2018-08-08 09:06:44,"[#Travaux #Ligne8] 🚧⚠️La ligne sera fermée entre Maisons-Alfort Les Juilliottes et Créteil Pointe du Lac, du lundi… https://t.co/Cp0MfGUmBl"
2018-08-08 08:35:31,"10:34, le trafic est rétabli sur la ligne (panne de signalisation)  #RATP #ligne8"
2018-08-08 07:04:31,"09:03, le trafic est perturbé sur la ligne (panne de signalisation)  #RATP #ligne8"
2018-08-08 06:45:30,"08:44, le trafic reprend progressivement sur la ligne (panne de signalisation)  #RATP #ligne8"
2018-08-08 06:42:18,"@CitoyenSoucieux Bonjour, le trafic n'est pas interrompu en direction de Balard mais reste perturbé en raison de l'… https://t.co/VAABeLG0nu"
2018-08-08 06:34:28,"08:33, le trafic est interrompu de La Motte-Picquet-Grenelle vers Republique. Reprise estimée à 09:00. (panne de si… https://t.co/CAPAgjNCO8"
2018-08-08 06:27:28,"08:26, la rame stationne à Concorde en dir. de Pointe du Lac (panne de signalisation)  #RATP #ligne8"
2018-08-07 08:29:58,"[Pic de #pollution] @IDFmobilites reconduit le mardi 7 août le forfait journalier antipollution à 3,80 euros pour s… https://t.co/oGW1p3aQpx"
2018-08-06 22:49:29,"00:48, le trafic est rétabli sur la ligne (panne de signalisation)  #RATP #ligne8"
2018-08-06 19:35:31,"21:33, le trafic est perturbé sur la ligne (panne de signalisation)  #RATP #ligne8"
2018-08-06 15:10:34,"[Pic de #pollution] @IDFmobilites reconduit le mardi 7 août le forfait journalier antipollution à 3,80 euros pour s… https://t.co/RHiFt1Z5bK"
2018-08-06 08:26:13,"[Pic de #pollution] @IDFmobilites met en place le lundi 6 août le forfait journalier anti-pollution à 3,80 euros po… https://t.co/WGISEqZFWk"
2018-08-05 15:52:58,"[Pic de #pollution] @IDFmobilites met en place le lundi 6 août le forfait journalier antipollution à 3,80 euros pou… https://t.co/2HGYHIVVdQ"
2018-08-04 04:44:01,"06:30, Suite à des travaux de modernisation, la station République est à nouveau ouverte au public. #RATP #ligne8 https://t.co/MSqJnztdgG"
2018-08-04 04:38:20,"06:30, Suite à des travaux de modernisation, la station République est à nouveau ouverte au public. #RATP #ligne8"
2018-08-03 06:26:30,"08:25, la rame repart de Republique en dir. de Balard  #RATP #ligne8"
2018-08-03 06:21:31,"08:20, la rame stationne à Republique en dir. de Balard (malaise voyageur)  #RATP #ligne8"
2018-08-02 09:00:01,"[#Travaux #Ligne8] 🚧⚠️ La ligne sera fermée entre Maisons-Alfort Les Juilliottes et Créteil Pointe du Lac, du lundi… https://t.co/d7pdJcNBp9"
2018-08-01 17:26:30,"19:25, le trafic est rétabli de Concorde vers Balard (train en panne)  #RATP #ligne8"
2018-08-01 17:17:28,"19:15, le trafic reprend progressivement de Concorde vers Balard (train en panne)  #RATP #ligne8"
2018-08-01 17:13:28,"19:12, le trafic est interrompu de Concorde vers Balard. Reprise estimée à 19:25. (train en panne)  #RATP #ligne8"
2018-08-01 14:34:38,"16:33, le trafic est rétabli entre La Motte-Picquet-Grenelle et Balard (train en panne)  #RATP #ligne8"
2018-08-01 14:22:29,"16:21, le trafic est perturbé entre La Motte-Picquet-Grenelle et Balard (train en panne)  #RATP #ligne8"
2018-08-01 12:00:35,"13:58, le trafic est rétabli sur la ligne (train en panne)  #RATP #ligne8"
2018-08-01 11:39:34,"13:38, le trafic est perturbé sur la ligne (train en panne)  #RATP #ligne8"
2018-08-01 11:15:30,"13:14, le trafic reprend progressivement sur la ligne (train en panne)  #RATP #ligne8"
2018-08-01 11:11:34,"13:09, le trafic est interrompu entre Reuilly-Did. et Pointe du Lac. Reprise estimée à 13:30. (train en panne)  #RATP #ligne8"
2018-08-01 11:09:30,"13:08, le trafic est interrompu entre Maisons-Alfort-Les Juilliottes et Pointe du Lac. Reprise estimée à 13:30. (tr… https://t.co/YT3yjvXTg5"
2018-08-01 11:01:30,"12:59, le trafic est interrompu entre Maisons-Alfort-Les Juilliottes et Pointe du Lac. Reprise estimée à 13:05. (tr… https://t.co/3emTgn6FEd"
2018-08-01 10:35:30,"12:33, le trafic est perturbé entre Pte de Charenton et Pointe du Lac (train en panne)  #RATP #ligne8"
2018-07-31 09:03:12,"[#Travaux #Ligne8] 🚧⚠️ La ligne sera fermée entre Maisons-Alfort Les Juilliottes et Créteil Pointe du Lac, du lundi… https://t.co/9p3KmFG2cp"
2018-07-31 07:56:30,"09:55, le trafic est rétabli sur la ligne (Personnes sur les voies)  #RATP #ligne8"
2018-07-31 07:45:30,"09:44, le trafic est perturbé sur la ligne (Personnes sur les voies)  #RATP #ligne8"
2018-07-31 07:03:29,"09:02, le trafic reprend progressivement sur la ligne (Personnes sur les voies)  #RATP #ligne8"
2018-07-31 06:58:29,"08:57, le trafic est interrompu entre Balard et Concorde. Reprise estimée à 10:00. (Personnes sur les voies)  #RATP #ligne8"
2018-07-30 18:50:55,"SNCF: Fin d'incident (conséquences de l'incendie du poste RTE d'Harcourt-Issy), les trains pour Bordeaux (et Sud ou… https://t.co/8m9eHM3jFW"
2018-07-30 07:00:21,"Suite aux conséquences de l'incendie du poste RTE d'Harcourt-Issy, les trains pour Bordeaux (et Sud ouest) partent… https://t.co/8qxXDlLa8T"
2018-07-29 18:37:31,"20:36, la station Concorde est rouverte  #RATP #ligne8"
2018-07-29 04:33:52,"06:31, la station Concorde est fermée (mesure de sécurité)  #RATP #ligne8"
2018-07-27 10:46:33,[#Travaux #Ligne8] Fermeture entre Maisons-Alfort - J. &amp; Créteil Pointe du Lac du 13 au 17/08. Nous avons posé 3 qu… https://t.co/sv0zxV6UCy
2018-07-26 16:17:52,@Lucie008 @IDFmobilites Bonne journée et à votre service.Yvson
2018-07-26 16:13:26,"@Lucie008 @IDFmobilites Ce forfait anti-pollution à 3,80 euro vous permet de voyager sur l'ensemble du réseau de pr… https://t.co/dTqEngzgcR"
2018-07-26 15:39:43,"[Pic de #pollution] @IDFmobilites reconduit le vendredi 27 juillet le forfait journalier antipollution à 3,80 euros… https://t.co/EcEiOBfX6l"
2018-07-26 08:33:23,"@SofiaDolle @ClientsRATP @Anne_Hidalgo Bonjour, pour votre information la ligne 8 ne bénéficie pas de climatisation… https://t.co/BJpyBlylum"
2018-07-25 09:36:35,"11:35, le trafic est rétabli sur la ligne (train en panne)  #RATP #ligne8"
2018-07-25 08:44:02,[Train en panne]: L'incident est résolu mais un délai est nécessaire pour un retour à un trafic régulier sur l'ense… https://t.co/BsnofGcCsb
2018-07-25 07:39:30,"09:38, le trafic est perturbé sur la ligne (train en panne)  #RATP #ligne8"
2018-07-25 06:44:32,"08:43, le trafic reprend progressivement sur la ligne (train en panne)  #RATP #ligne8"
2018-07-25 06:43:13,[Train en panne]: fin d'intervention de nos équipes techniques #RATP.  Le trafic reprend progressivement sur l'ense… https://t.co/jXnDSPZ8bR
2018-07-25 06:39:43,[Train en panne]: Arrivée de nos équipes techniques #RATP sur place. #ligne8.
2018-07-25 06:36:29,[Train en panne]: Nous sommes en attente de l'arrivée de nos équipes techniques #RATP sur place. #ligne8.
2018-07-25 06:23:28,"08:22, le trafic est interrompu de Balard vers Concorde. Reprise estimée à 08:45. (train en panne)  #RATP #ligne8"
2018-07-25 06:20:35,"08:19, la rame stationne à Ecole Militaire en dir. de Pointe du Lac (train en panne)  #RATP #ligne8"
2018-07-25 04:03:10,[Pic de #pollution] @IDFmobilites met en place mercredi 25 et jeudi 26 juillet le forfait journalier anti-pollution… https://t.co/j1FM6lSBqe
2018-07-24 16:48:28,[Pic de #pollution] @IDFmobilites met en place mercredi 25 et jeudi 26 juillet le forfait journalier anti-pollution… https://t.co/6voEJYZNPB
2018-07-24 13:04:31,"15:03, le trafic est rétabli sur la ligne (bagage oublié)  #RATP #ligne8"
2018-07-24 12:03:28,"14:02, le trafic est perturbé sur la ligne (bagage oublié)  #RATP #ligne8"
2018-07-24 11:52:29,"13:50, la rame stationne à Republique en dir. de Balard (bagage oublié)  #RATP #ligne8"
2018-07-20 17:28:17,"Incident terminé (train en panne), le trafic est rétabli sur l'ensemble de la ligne. RATP #ligne8"
2018-07-20 16:04:55,"@Magaliloo2 Bonjour, le trafic est toujours perturbé sur l'ensemble de la ligne.  Bonne soirée. Kris"
2018-07-20 15:54:27,"@Berenger_ Bonjour, il s'agit en effet d'une erreur de saisie. bonne soirée à vous. Kris"
2018-07-20 15:33:30,"16:28, le trafic est perturbé sur la ligne (train en panne)  #RATP #ligne8"
2018-07-20 15:17:30,"17:16, le trafic est interrompu entre Reuilly-Did. et Maisons-Alfort-Les Juilliottes. Reprise estimée à 17:30. (tra… https://t.co/GACH7UxflM"
2018-07-20 14:59:32,"16:58, la rame stationne à Montgallet en dir. de Pointe du Lac (train en panne)  #RATP #ligne8"
2018-07-19 22:24:32,"00:22, le trafic est perturbé sur la ligne (incident technique)  #RATP #ligne8"
2018-07-19 22:24:29,"00:23, le trafic est perturbé sur la ligne (incident technique)  #RATP #ligne8"
2018-07-19 21:39:28,"23:38, le trafic reprend progressivement entre Maisons-Alfort-Les Juilliottes et Pointe du Lac (incident technique)  #RATP #ligne8"
2018-07-19 21:34:32,"23:33, le trafic est interrompu entre Maisons-Alfort-Les Juilliottes et Pointe du Lac. Reprise estimée à 23:59. (in… https://t.co/f9av23j810"
2018-07-19 21:24:32,"23:23, le trafic est perturbé entre Pte de Charenton et Pointe du Lac (incident technique)  #RATP #ligne8"
2018-07-19 19:07:29,"21:06, le trafic est perturbé de Pointe du Lac vers Balard (incident technique)  #RATP #ligne8"
2018-07-19 17:29:29,"19:28, le trafic est rétabli sur la ligne (Personnes sur les voies)  #RATP #ligne8"
2018-07-19 17:05:30,"19:04, le trafic est perturbé sur la ligne (Personnes sur les voies)  #RATP #ligne8"
2018-07-19 16:54:31,"18:53, le trafic est rétabli sur la ligne (Personnes sur les voies)  #RATP #ligne8"
2018-07-19 16:39:30,"18:37, le trafic est interrompu entre Strasbourg-St-Denis et Reuilly-Did. Reprise estimée à 19:00. (Personnes sur les voies)  #RATP #ligne8"
2018-07-19 16:32:29,"18:31, le trafic est interrompu entre Strasbourg-St-Denis et Reuilly-Did. Reprise estimée à 18:40. (Personnes sur les voies)  #RATP #ligne8"
2018-07-19 16:06:38,"18:05, le trafic est rétabli sur la ligne (panne de signalisation)  #RATP #ligne8"
2018-07-19 15:45:33,"17:43, le trafic est perturbé de Pointe du Lac vers Balard (panne de signalisation)  #RATP #ligne8"
2018-07-18 10:28:45,"Et pour absorber l’augmentation attendue du nombre de voyageurs sur la #ligne8, les espaces de la station Créteil-L… https://t.co/H0Xu9PCN8W"
2018-07-18 10:28:45,"6 modules vont ainsi être déplacés sous la voie par une grue, et grâce à une mobilisation exceptionnelle sur le cha… https://t.co/Z1EBSAjUph"
2018-07-18 10:28:44,"D’ici fin 2022, la ligne 8 sera en correspondance avec la nouvelle ligne 15 Sud à la station Créteil-L’Échat. Un pa… https://t.co/hjkKn6grKf"
2018-07-18 10:28:44,"[#Travaux #Ligne8] 🚧⚠️ La ligne sera fermée entre Maisons-Alfort Les Juilliottes et Créteil Pointe du Lac, du lundi… https://t.co/ypqxE1MnHN"
2018-07-18 09:30:11,"@toutouneee @Randy110912 Ah mais si vous êtes également au courant n'hésitez pas, je suis preneuse de toute informa… https://t.co/7sTWqNp3lx"
2018-07-18 09:07:06,"@Randy110912 Bonjour Randy, avez-vous à votre disposition le numéro de rame ou bien heure, station, direction ? Pou… https://t.co/Xe9eKNPzJm"
2018-07-17 19:58:29,"21:57, le trafic est rétabli sur la ligne (Personnes sur les voies)  #RATP #ligne8"
2018-07-17 19:32:29,"21:31, le trafic reprend progressivement sur la ligne (Personnes sur les voies)  #RATP #ligne8"
2018-07-17 19:23:29,"21:22, la rame stationne à Creteil-L'Echat (Hopital Henri Mondor) en dir. de Pointe du Lac (Personnes sur les voies)  #RATP #ligne8"
2018-07-16 17:44:29,"19:43, la station Concorde est rouvert  #RATP #ligne8"
2018-07-16 17:43:30,"19:42, l'arrêt est à nouveau marqué à Concorde  #RATP #ligne8"
2018-07-16 16:29:30,"18:27, le trafic est rétabli sur la ligne (incident d'exploitation)  #RATP #ligne8"
2018-07-16 15:35:29,"17:34, le trafic est perturbé sur la ligne (incident d'exploitation)  #RATP #ligne8"
2018-07-16 15:32:19,La rame est repartie de la station Porte Dorée en direction de Pointe du Lac #RATP #Ligne8
2018-07-16 15:29:28,"17:28, la rame stationne à Porte Doree en dir. de Pointe du Lac (incident d'exploitation)  #RATP #ligne8"
2018-07-16 10:15:30,"12:13, la station Concorde est fermée (mesure de sécurité)  #RATP #ligne8"
2018-07-16 10:15:09,"12:12, l'arrêt n'est pas marqué à Concorde (mesure de sécurité)  #RATP #ligne8"
2018-07-16 07:44:51,"@Laura_Laque Bonjour, L'incident à Faidherbe Chaligny en D° de Balard est terminé.Le trafic est normal sur la ligne 8.Bonne journée.Yvson"
2018-07-16 07:28:37,@OldTraffordC A votre service.Bonne journée.Yvson
2018-07-16 07:24:10,"@OldTraffordC Bonjour, Suite au retour de l'équipe de France, la station Madeleine n'est pas prévue d'être fermée. Bonne journée.Yvson"
2018-07-16 06:19:41,"[#CM2018] Par mesure de sécurité la station Concorde fermera vers 12h. Les trains ne marqueront pas l’arrêt, les co… https://t.co/himfmLFK4m"
2018-07-16 06:19:09,"[#CM2018]   En raison des festivités à l’occasion du retour de l’ @equipedefrance , certaines stations de métro fer… https://t.co/Llp9WNqjgC"
2018-07-16 04:31:57,"[#CM2018] Par mesure de sécurité la station Concorde fermera vers 12h. Les trains ne marqueront pas l’arrêt, les co… https://t.co/B8i2XfiUcR"
2018-07-16 04:31:37,"[#CM2018]   En raison des festivités à l’occasion du retour de l’ @equipedefrance , certaines stations de métro fer… https://t.co/SvMnyUjgNS"
2018-07-15 22:11:38,"00:10, la station La Motte-Picquet-Grenelle est rouvert  #RATP #ligne8"
2018-07-15 22:01:33,"00:00, la station Ecole Militaire est rouvert  #RATP #ligne8"
2018-07-15 21:53:30,"23:52, la station Concorde est rouvert  #RATP #ligne8"
2018-07-15 20:41:32,"22:40, l'arrêt est à nouveau marqué à Invalides  #RATP #ligne8"
2018-07-15 20:40:22,Les trains marquent de nouveau l'arrêt à la station Invalides. #Ligne8 #RATP
2018-07-15 18:32:30,"20:31, l'arrêt n'est pas marqué à Invalides (mesure de sécurité)  #RATP #ligne8"
2018-07-15 18:31:11,"@Poeiin Bonsoir, la station Invalides est ouverte , mais pendant quelques minutes les trains ne vont plus marquer l… https://t.co/IYMpzOWDei"
2018-07-15 18:29:01,"Par mesure de sécurité, et en raison de la forte affluence de voyageurs, les trains ne marquent pas l'arrêt à la st… https://t.co/SKGzP9MYpy"
2018-07-15 17:43:02,"@PirezJacques Bonsoir, actuellement il n'y a pas de fermeture prévue de la station Invalides. Bonne soirée. Fred."
2018-07-15 16:54:28,"18:53, la station Concorde est fermée (mesure de sécurité)  #RATP #ligne8"
2018-07-15 12:54:36,"[#CM2018] A la demande de la Police, il est déconseillé de se rendre sur la Fan Zone du champ de Mars, en raison de… https://t.co/wU5194l0v1"
2018-07-15 11:27:29,"13:26, la station La Motte-Picquet-Grenelle est fermée (mesure de sécurité)  #RATP #ligne8"
2018-07-15 11:23:28,"13:22, la station Ecole Militaire est fermée (mesure de sécurité)  #RATP #ligne8"
2018-07-15 06:56:19,"[Finale #CM2018 #FRACRO] Par mesure de sécurité la station Concorde fermera vers 18h40, jusqu’à nouvel ordre. Les t… https://t.co/jEo9cngcIa"
2018-07-15 06:56:03,[Finale #CM2018 #FRACRO] Par mesure de sécurité les stations Ecole Militaire et La Motte-Picquet- Grenelle fermeron… https://t.co/xtFrOrcxgp
2018-07-15 06:55:47,[Finale #CM2018]   En raison de la retransmission de la Finale #FRACRO au Champ-de-Mars certaines stations de métro… https://t.co/OZnLFStCxh
2018-07-14 21:06:46,"[spectacle du #14juillet] A la station La Motte Picquet Grenelle, les sorties 4 (rue de Pondichéry) et 5 (avenue de… https://t.co/3GNxo4ZuU1"
2018-07-14 13:05:03,La station Concorde est rouverte #RATP #ligne8
2018-07-14 10:51:41,[Spectacle du #14juillet] La réouverture de la station La Motte-Picquet Grenelle se fera à la demande de la #Police. #Ligne8 #RATP
2018-07-14 10:51:26,"[Spectacle du #14juillet] Par mesure de sécurité et sur ordre de la @prefpolice, la station La Motte-Picquet Grenel… https://t.co/q6jIMoURT4"
2018-07-14 05:22:39,"[Défilé du #14juillet] Par mesure de sécurité, sur ordre de la @prefpolice, la station Concorde n'ouvrira pas samed… https://t.co/5ksRzuvVxA"
2018-07-14 03:31:29,"05:30, la station Concorde est fermée. Reprise estimée à 12:00. (mesure de sécurité)  #RATP #ligne8"
2018-07-13 16:30:47,"[Défilé du #14juillet] La réouverture de la station Concorde se fera à la demande de la #Police (vers midi, sous réserves). #Ligne8 #RATP"
2018-07-13 16:26:48,"[Défilé du #14juillet] Par mesure de sécurité, sur ordre de la @prefpolice, la station Concorde n'ouvrira pas samed… https://t.co/xVMy3OojGn"
2018-07-13 15:26:30,RT @GroupeRATP: Pour préparer votre #14juillet &amp; votre dimanche de #CoupeDuMonde #FRACRO ⚽️retrouvez toutes les infos transports #RATP ➡️ht…
2018-07-13 13:55:31,"15:54, le trafic est rétabli sur la ligne (malaise voyageur)  #RATP #ligne8"
2018-07-13 13:24:29,"15:23, le trafic reprend progressivement sur la ligne (malaise voyageur)  #RATP #ligne8"
2018-07-13 13:18:29,"15:17, le trafic est interrompu entre La Motte-Picquet-Grenelle et Concorde. Reprise estimée à 15:45. (malaise voyageur)  #RATP #ligne8"
2018-07-13 13:10:28,"15:09, le trafic est perturbé sur la ligne (malaise voyageur)  #RATP #ligne8"
2018-07-12 15:28:35,RT @RER_A: [#TravauxEteRERA J-15] Nous vous aidons à préparer vos trajets alternatifs pour la fermeture estivale du #RERA ➡https://t.co/tp3…
2018-07-12 14:09:29,"16:08, le trafic est rétabli sur la ligne (panne de signalisation)  #RATP #ligne8"
2018-07-12 13:37:44,"@KroppJack Bonjour, actuellement le trafic n'est pas interrompu mais juste perturbé. Bonne journée. Fred."
2018-07-12 13:36:24,L’anomalie nous oblige à appliquer des mesures de sécurité ralentissant le trafic #Ligne8 #RATP
2018-07-12 13:25:28,"15:24, le trafic est perturbé entre Balard et Concorde (panne de signalisation)  #RATP #ligne8"
2018-07-11 10:27:10,"[#Travaux #Ligne8] 🚧⚠️ La ligne sera fermée entre Maisons-Alfort Les Juilliottes et Créteil Pointe du Lac, du lundi… https://t.co/YLfITIuia9"
2018-07-11 09:59:33,"11:57, le trafic est rétabli sur la ligne (train en panne)  #RATP #ligne8"
2018-07-11 08:01:11,"@Clement673 Bonjour, L'incident est terminé (train en panne à Charenton Ecoles D° Balard).Le trafic reste néanmoins… https://t.co/Ryrd2tLxfX"
2018-07-11 07:59:30,"09:57, le trafic est perturbé sur la ligne (train en panne)  #RATP #ligne8"
2018-07-11 07:51:30,"09:50, le trafic reprend progressivement sur la ligne (train en panne)  #RATP #ligne8"
