time,tweet
2018-03-05 14:06:48,"15:04, le trafic est interrompu entre Maisons-Alfort-Les Juilliottes et Reuilly-Did. (Personnes sur les voies) #RATP #Ligne8"
2018-03-05 11:49:44,Retour à un trafic régulier sur l'ensemble de la #Ligne8 #RATP. Incident terminé.
2018-03-05 11:22:44,"12:19, le trafic est perturbé de Maisons-Alfort-Les Juilliottes vers Balard (panne de signalisation) #RATP #Ligne8"
2018-03-03 05:30:47,Retour à un trafic régulier sur l'ensemble de la #Ligne8 #RATP. Incident terminé.
2018-03-03 05:26:49,Incident terminé à Balard. Trafic normal sur l'ensemble de la #Ligne8 #RATP
2018-03-03 04:34:44,"05:32, le trafic est perturbé de Balard vers Pointe du Lac (train en panne) #RATP #Ligne8"
2018-03-02 14:07:44,"Les #César2018 c'est ce soir ! Cette année, #LeBrio d’Yvan ATTAL, tourné sur les lignes 3bis et 8 de notre réseau,… https://t.co/y8cZhGdul2"
2018-03-01 11:52:44,Retour à un trafic régulier sur l'ensemble de la #Ligne8 #RATP. Incident terminé.
2018-03-01 11:43:18,Retour à un trafic régulier sur l'ensemble de la #Ligne8 #RATP. Incident terminé
2018-03-01 11:11:44,"12:09, le trafic est perturbé sur la ligne (incident voyageur) #RATP #Ligne8"
2018-03-01 08:45:05,"[#Neige #Verglas ❄] Le trafic est normal pour le métro, le tramway et le RER. La circulation des bus s’améliore en… https://t.co/O85Qcm8UwR"
2018-02-28 09:03:44,Retour à un trafic régulier sur l'ensemble de la #Ligne8 #RATP. Incident terminé.
2018-02-28 08:57:50,Retour à un trafic régulier sur l'ensemble de la #Ligne8 #RATP. Incident terminé
2018-02-28 07:58:34,@Leavennah Bonjour. Merci de votre signalement. Je l'ai transmis su service concerné. Tom
2018-02-28 07:37:41,"@affiss_w Bonjour, effectivement le trafic est encore perturbé en direction de Pointe du lac essentiellement. Bonne journée. PFM"
2018-02-28 07:08:37,"@BookywormLiz Le trafic est toujours perturbé, nos régulateurs mettent tout en œuvre pour rétablir un trafic régulier. Bonne journée. Tom"
2018-02-28 06:22:44,"07:19, le trafic est perturbé sur la ligne (incident technique) #RATP #Ligne8"
2018-02-28 06:21:44,"L'incident est terminé à École vétérinaire, le trafic reste perturbé sur la #ligne8 #RATP"
2018-02-28 06:10:37,"07:09, Les dernières vérifications de sécurité ont été effectuées, le trafic de votre ligne va reprendre dans quelq… https://t.co/ZAm5fzkjzW"
2018-02-28 05:47:44,"06:44, la rame stationne à Ecole Veterinaire de Maisons-Alfort en dir. de Balard (incident technique) #RATP #Ligne8"
2018-02-26 17:40:21,"@Kisa96Oceane Bonsoir, plusieurs incidents (panne de signalisation, incident technique sur une rame, incident voyag… https://t.co/g292vuOzRk"
2018-02-26 16:32:46,Retour à un trafic régulier sur l'ensemble de la #Ligne8 #RATP. Incident terminé.
2018-02-26 16:32:27,Retour à un trafic régulier sur l'ensemble de la #Ligne8 #RATP.Incident terminé
2018-02-26 16:05:48,"17:04, le trafic est perturbé entre Balard et La Motte-Picquet-Grenelle (panne de signalisation) #RATP #Ligne8"
2018-02-26 16:04:44,"17:02, la rame stationne à La Motte-Picquet-Grenelle en dir. de Balard (panne de signalisation) #RATP #Ligne8"
2018-02-26 06:54:13,Retour à un trafic régulier sur l'ensemble de la #Ligne8 #RATP. Incident terminé
2018-02-26 06:15:42,"@a4be9278859f478 Bonjour, le trafic est toujours perturbé sur l'ensemble de la ligne. Bonne journée, Léo."
2018-02-26 05:35:46,"06:33, le trafic est perturbé sur la ligne (train en panne) #RATP #Ligne8"
2018-02-26 05:34:29,[Train en panne] La rame est repartie de Liberté direction Balard. Le trafic reste perturbé #Ligne8
2018-02-26 05:14:24,"06h13, nos équipes techniques #RATP diagnostiquent une avarie de porte #Ligne8"
2018-02-26 05:11:54,"06h11, l’incident technique a lieu à la station Liberté #Ligne8 #RATP"
2018-02-26 05:11:44,"06:08, la rame stationne à Liberte en dir. de Balard (train en panne) #RATP #Ligne8"
2018-02-26 05:10:47,"06h10, un incident vient de se produire, nous vous tenons informés dans les meilleurs délais #RATP #Ligne8"
2018-02-25 18:56:44,Retour à un trafic régulier sur l'ensemble de la #Ligne8 #RATP. Incident terminé.
2018-02-25 06:52:47,Retour à un trafic régulier sur l'ensemble de la #Ligne8 #RATP. Incident terminé.
2018-02-25 06:40:46,"07:38, la rame stationne à Pointe du Lac en dir. de Balard (Personnes sur les voies) #RATP #Ligne8"
2018-02-23 16:43:11,"@MuffinFraise Bonjour, merci de cette information, nous faisons le nécessaire pour retirer cette information auprès… https://t.co/3TPZzOvQSq"
2018-02-23 14:16:45,"Embarquez tranquillement dans les aéroports parisiens grâce au Roissybus, au Orlybus et à la navette Paris-Beauvais… https://t.co/7WVWdETzfz"
2018-02-22 23:11:44,Retour à un trafic régulier sur l'ensemble de la #Ligne8 #RATP. Incident terminé.
2018-02-22 22:19:45,"23:18, le trafic est perturbé sur la ligne (train en panne) #RATP #Ligne8"
2018-02-22 21:30:44,"22:29, le trafic reprend progressivement (train en panne) #RATP #Ligne8"
2018-02-22 21:00:44,"21:58, le trafic est interrompu entre La Motte-Picquet-Grenelle et Republique. Reprise estimée à 22:30. (train en panne) #RATP #Ligne8"
2018-02-22 20:56:44,"21:54, le trafic est interrompu entre La Motte-Picquet-Grenelle et Republique (train en panne) #RATP #Ligne8"
2018-02-22 20:54:56,"21:52, le trafic est perturbé sur la ligne (train en panne) #RATP #Ligne8"
2018-02-22 17:14:51,"RT @GroupeRATP: [ Pic de #pollution vendredi 23 février ] 
@IDFmobilites met en place le forfait antipollution à 3,80 euros pour se déplace…"
2018-02-21 17:51:29,"18h50, le trafic est rétabli sur la ligne #RATP #Ligne8"
2018-02-21 16:57:45,"@Clarysa31 Bonjour, le trafic est perturbé  entre Richelieu Drouot et Bastille, plutôt en direction de Créteil. Le… https://t.co/9DjEHs6p4m"
2018-02-21 16:43:45,"17:41, le trafic est perturbé sur la ligne (incident technique) #RATP #Ligne8"
2018-02-21 14:41:09,RT @Ligne5_RATP: [Lafabrique.ratp] Une dizaine de nos voyageurs participent au 1er atelier d'experts dans notre lieu connecté à la station…
2018-02-21 11:08:13,Retour à un trafic régulier sur l'ensemble de la #Ligne8 #RATP. Incident terminé.
2018-02-21 10:27:47,"11:26, le trafic est perturbé de Pointe du Lac vers Balard (train en panne) #RATP #Ligne8"
2018-02-21 10:22:17,"@CathHml Bonjour, Nous vous informons qu'un train est en panne entre Créteil Pointe du Lac et Créteil Préfecture en… https://t.co/yQlASS60ub"
2018-02-21 10:14:46,"11:12, la rame stationne à Creteil-Prefecture (Hotel de Ville) en dir. de Balard (train en panne) #RATP #Ligne8"
2018-02-21 06:18:34,Retour à un trafic régulier sur l'ensemble de la #Ligne8 #RATP. Incident terminé
2018-02-21 05:15:40,"@Regio_2N Bonjour, nous avions un train en panne entre Créteil-Préfecture et Pointe du Lac. Nous avons envoyé les p… https://t.co/TfDaEZWsYZ"
2018-02-21 05:00:47,"05:59, le trafic est perturbé sur la ligne (train en panne) #RATP #Ligne8"
2018-02-21 04:59:31,"[Train en panne] 05:57, Fin d'incident à Créteil-Préfecture mais le trafic reste perturbé sur la #Ligne8 #RATP"
2018-02-21 04:54:08,"[Train en panne] 05:52, le trafic est interrompu entre Maisons-Alfort Les Juilliottes et Créteil-Préfecture. Repris… https://t.co/S8pfdrx8SV"
2018-02-21 04:43:00,"05:37, le trafic est perturbé de Pointe du Lac vers Balard (train en panne) #RATP #Ligne8"
2018-02-20 21:23:56,Retour à un trafic régulier sur l'ensemble de la #Ligne8 #RATP. Incident terminé.
2018-02-20 21:07:45,"22:06, le trafic est perturbé sur la ligne (incident voyageur) #RATP #Ligne8"
2018-02-19 19:29:16,Incident terminé. Retour à un trafic normal sur l'ensemble de la #Ligne8 #RATP
2018-02-19 17:36:47,"18:35, le trafic est perturbé sur la ligne (malaise voyageur) #RATP #Ligne8"
2018-02-16 18:39:53,Le trafic est normal sur la ligne 8 du métro. #RATP #Ligne8
2018-02-16 17:49:46,"18:47, le trafic reprend progressivement (bagage oublié) #RATP #Ligne8"
2018-02-16 17:41:25,"L'incident est terminé, le trafic va reprendre dans quelques instants. #RATP #Ligne8"
2018-02-16 17:08:24,Les forces de police interviennent sur place. #RATP #Ligne8
2018-02-16 16:50:45,"17:49, le trafic est interrompu entre Balard et La Motte-Picquet-Grenelle. Reprise estimée à 18:55. (bagage oublié) #RATP #Ligne8"
2018-02-16 16:47:45,"17:45, le trafic est interrompu entre Balard et La Motte-Picquet-Grenelle (bagage oublié) #RATP #Ligne8"
2018-02-16 16:43:47,"17:41, la rame stationne à Commerce en dir. de Balard (bagage oublié) #RATP #Ligne8"
2018-02-16 14:52:05,@Jarmau C'est une question de régulation de trafic. Ces déséquilibres de fréquences peuvent survenir pour plusieurs… https://t.co/srWQTbA5AQ
2018-02-16 14:43:45,Retour à un trafic régulier sur l'ensemble de la #Ligne8 #RATP. Incident terminé.
2018-02-16 14:25:46,"15:22, la rame stationne à Ecole Veterinaire de Maisons-Alfort en dir. de Pointe du Lac (malaise voyageur) #RATP #Ligne8"
2018-02-15 09:26:36,"@Clmce_C Bonjour, Nous venons de prendre connaissance de votre tweet. Nous nous renseignons et revenons vers vous a… https://t.co/gqXpgFoXu7"
2018-02-15 08:42:45,Retour à un trafic régulier sur l'ensemble de la #Ligne8 #RATP. Incident terminé.
2018-02-15 07:19:44,@Ladydownstairs A votre service et bonne journée. Yvson
2018-02-15 07:18:40,@jeanroman_ A votre service . Bonne journée également. Yvson
2018-02-15 07:08:43,"@RvShark @Ladydownstairs Bonjour, Suite à un train en panne à Invalides (incident terminé), le trafic est perturbé… https://t.co/BxNdsNiPIi"
2018-02-15 07:07:19,"@jeanroman_ Bonjour, Une panne d'un train à Invalides (incident terminé) est à l'origine des perturbations sur la l… https://t.co/wZcTxPWGF5"
2018-02-15 07:04:09,"@Ladydownstairs Bonjour, le prochain train en D° de Créteil à Strasbourg St Denis se situe à la station Richelieu D… https://t.co/BB8EFA6uuZ"
2018-02-15 07:02:39,"@gaellefert Bonjour, Suite à un train en panne à Invalides (incident terminé), le trafic est perturbé sur l'ensembl… https://t.co/umOHYyt2GH"
2018-02-15 06:49:10,"@KroppJack Bonjour, Pour modifier votre trajet, vous êtes invités à consulter la recherche d’itinéraire sur l’Appli… https://t.co/dnweRBMnq6"
2018-02-15 06:47:45,"07:45, le trafic est perturbé sur la ligne (train en panne) #RATP #Ligne8"
2018-02-15 06:46:45,"07:44, le trafic est interrompu entre Concorde et La Motte-Picquet-Grenelle (train en panne) #RATP #Ligne8"
2018-02-15 06:44:45,"07:42, le trafic est perturbé sur la ligne (train en panne) #RATP #Ligne8"
2018-02-13 18:54:08,Incident terminé (train en panne) le trafic est rétabli sur l'ensemble de  la ligne. #RATP #Ligne8
2018-02-13 16:44:45,"17:42, le trafic est perturbé sur la ligne (train en panne) #RATP #Ligne8"
2018-02-13 16:38:08,La rame devrait repartir dans quelques instants. Merci de votre patience. #RATP #Ligne8
2018-02-13 16:28:42,La rame est toujours en panne à la station Faidherbe-Chaligny en raison de freins bloqués. Nous faisons le maximum… https://t.co/lvF3xolDTj
2018-02-13 16:08:51,"17:05, la rame stationne à Faidherbe-Chal. en dir. de Balard (train en panne) #RATP #Ligne8"
2018-02-12 18:17:52,Retour à un trafic régulier sur l'ensemble de la #Ligne8 #RATP. Incident terminé.
2018-02-12 18:08:45,La rame est repartie. #RATP #Ligne8
2018-02-12 18:05:38,"@Minibiscuitt Bonsoir, le train a stationné pour intervention des secours. Il est reparti. Bonne soirée. Tino. #RATP #Ligne8"
2018-02-12 18:02:49,"@Cay_Lia @Minibiscuitt Bonsoir, un malaise voyageur entraine le stationnement du train à Reuilly-Diderot, en attent… https://t.co/V5wX29Qq5W"
2018-02-12 18:02:46,"18:59, la rame stationne à Reuilly-Did. en dir. de Pointe du Lac (malaise voyageur) #RATP #Ligne8"
2018-02-12 13:48:36,"@Styl_Nox Bonjour, pourriez-vous me préciser le lieu exacte à Opéra où votre nez est rentré en contact avec cette o… https://t.co/vdFplTXsPG"
2018-02-09 16:20:46,"17:17, le trafic est perturbé sur la ligne (malaise voyageur) #RATP #Ligne8"
2018-02-09 16:17:45,"17:13, le trafic reprend progressivement (malaise voyageur) #RATP #Ligne8"
2018-02-09 15:40:45,"16:35, le trafic reprend progressivement. Reprise estimée à 17:00. (malaise voyageur) #RATP #Ligne8"
2018-02-09 15:27:31,"@Cay_Lia Bonjour, les trains circulent bien sur ce tronçon (interuption Créteil-Préfecture Pointe du Lac). Bonne journée. Tino."
2018-02-09 15:25:16,Les secours interviennent sur place.  #Ligne8 #RATP
2018-02-09 15:02:54,"Le trafic est interrompu entre Créteil-Préfecture et Pointe du lac, suite à malaise voyageur. Reprise estimée vers 17h00. #Ligne8 #RATP"
2018-02-09 10:55:07,"RT @GroupeRATP: [Intempéries #Neige ❄️] Philippe Martin, DGA #RATP, nous explique tout sur la mobilisation de l'entreprise. https://t.co/Y4…"
2018-02-09 09:30:01,Retour à un trafic régulier sur l'ensemble de la #Ligne8 #RATP. Incident terminé.
2018-02-09 09:14:46,"10:10, le trafic reprend progressivement (Personnes sur les voies) #RATP #Ligne8"
2018-02-09 09:09:45,"06:11, le trafic est interrompu entre Concorde et Republique (Personnes sur les voies) #RATP #Ligne8"
2018-02-08 18:00:16,"[#ParisSousLaNeige ❄] Pour tout savoir sur l'état du trafic tout au long de la journée sur le réseau #RATP, consult… https://t.co/t6FPANA5O7"
2018-02-08 08:28:10,"@Lili_151194 Bonjour, Des infos pour quelle ligne de bus? Bonne journée. Yvson"
2018-02-07 22:35:03,"Plus de Bus ce soir sur Paris et sa Banlieue, de plus aucun Noctilien dans la nuit du 7 au 8 février #RATP"
2018-02-07 21:27:45,"[#Neige ❄] Pour la journée du jeudi 8 février, #RATP prévoit un trafic légèrement perturbé sur les réseaux Métro et RER."
2018-02-07 17:48:50,Retour à un trafic régulier sur l'ensemble de la #Ligne8 #RATP. Incident terminé.
2018-02-07 17:38:26,"18h36, le trafic est rétabli sur la #RATP #Ligne8."
2018-02-07 16:51:45,"17:49, le trafic est perturbé sur la ligne (malaise voyageur) #RATP #Ligne8"
2018-02-07 16:50:16,"17h49, en raison d'un malaise voyageur, le trafic est perturbé sur l'ensemble de la ligne  #Ligne8 #RATP"
2018-02-07 16:36:45,"17:33, la rame stationne à Madeleine en dir. de Balard (malaise voyageur) #RATP #Ligne8"
2018-02-07 13:42:40,"@barzek Bonjour, pour informations, il existe des parties de voies aériennes sur la ligne 8 susceptibles d'être  af… https://t.co/PQIgWNmVSv"
2018-02-07 11:26:25,Incident terminé. Retour à un trafic normal sur l'ensemble de la #Ligne8 #RATP
2018-02-07 10:30:16,[#Neige ❄] Le trafic sur la #Ligne8 est perturbé avec 1 train sur 2 en moyenne en raison de la météo. Nos équipes s… https://t.co/yW635euwTG
2018-02-07 10:21:11,"[#Neige ❄] Le trafic sur la #Ligne8 est perturbé avec 1 train sur 2 en moyenne en raison de la météo.
Nos équipes s… https://t.co/eu9o6PKdVT"
2018-02-07 09:23:41,"@Lili_151194 Bonjour, L'incident est terminé. Néanmoins, le trafic reste perturbé sur l'ensemble de la ligne8. Bonne journée. Yvson"
2018-02-07 08:50:40,"@Laptiote_ Bonjour, Un train va entrer à Charenton Ecoles en D° de Balard. Bonne journée. Yvson"
2018-02-07 08:49:45,"@Laptiote_ Bonjour, Malgré les mauvaises conditions climatiques, les trains circulent sur la ligne8. Néanmoins, le… https://t.co/v3IU5u50O6"
2018-02-07 06:53:38,"@shariantm Bonjour, le trafic n'est pas interrompu entre Maison Alfort et Créteil. Néanmoins, le trafic reste perturbé. Bonne journée. Yvson"
2018-02-07 05:59:36,"06:56, le trafic est perturbé entre Maisons-Alfort-S. et Creteil-Prefecture (Hotel de Ville) (conditions climatiques) #RATP #Ligne8"
2018-02-07 05:27:58,"@JuuliieDreams Bonjour, les trains circulent normalement sur la ligne8. Bonne journée. Yvson"
2018-02-07 01:38:46,Retour à un trafic régulier sur l'ensemble de la #Ligne8 #RATP. Incident terminé.
2018-02-07 00:47:46,Retour à un trafic régulier sur l'ensemble de la #Ligne8 #RATP
2018-02-07 00:08:27,"@AntoineK_Magnum Ok merci on va se rapprocher de la station Créteil-Préfecture. Merci. Bonne nuit à vous, Léo"
2018-02-07 00:05:53,@AntoineK_Magnum Quelle est la station dans laquelle se trouve ces personnes? Léo
2018-02-06 23:55:00,@AntoineK_Magnum Bonsoir où vous trouvez-vous? Léo
2018-02-06 23:11:35,"00:08, la rame stationne à Creteil-Prefecture (Hotel de Ville) en dir. de Balard (incident voyageur) #RATP #Ligne8"
2018-02-06 09:37:31,"@maelle_gaultier Bonjour Maelle, il est vrai que ce type ""d'art"" n'est pas partagé par tous, néanmoins il devrait ê… https://t.co/mHa3G5Ankl"
2018-02-05 19:49:13,Retour à un trafic régulier sur l'ensemble de la #Ligne8 #RATP
2018-02-05 19:02:34,"19:59, le trafic est perturbé sur la ligne (incident voyageur) #RATP #Ligne8"
2018-02-05 18:54:28,[incident voyageur] Fin d'incident à Porte Dorée. Nos agents de sécurité #RATP sont intervenus dans la rame de la #Ligne8
2018-02-05 18:48:37,"19:42, la rame stationne à Porte Doree en dir. de Balard (incident voyageur) #RATP #Ligne8"
2018-02-05 16:25:35,Le trafic sur #Ligne8 #RATP est désormais régulier.
2018-02-05 15:43:19,"@Tetz_is_pa Bonsoir, l'incident est terminé à Faidherbe-Chaligny mais le trafic n'est pas tout à fait rétabli #Ligne8 #RATP"
2018-02-05 15:12:35,"16:11, le trafic est perturbé sur la ligne (malaise voyageur) #RATP #Ligne8"
2018-02-05 14:55:54,[malaise voyageur] Un voyageur a fait un malaise dans la rame. Les services de secours ont été contactés pour une i… https://t.co/aSLbEbB8tc
2018-02-05 14:52:35,"15:49, la rame stationne à Faidherbe-Chal. en dir. de Balard (malaise voyageur) #RATP #Ligne8"
2018-02-05 14:27:42,Retour à un trafic régulier sur l'ensemble de la #Ligne8 #RATP. Incident terminé.
2018-02-05 13:49:34,"14:45, le trafic est perturbé sur la ligne (bagage oublié) #RATP #Ligne8"
2018-02-05 13:45:15,[Bagage oublié] Fin d'incident à Concorde. Le trafic reste malgré tout perturbé sur la #Ligne8 #RATP
2018-02-05 13:42:40,"14:40, le trafic est perturbé entre Balard et Republique (bagage oublié) #RATP #Ligne8"
2018-02-05 12:09:53,Incident terminé (panne de signalisation à Créteil l'Echat). Retour à un trafic normal sur l'ensemble de la #Ligne8 #RATP
2018-02-05 11:12:09,"En raison d'une panne de signalisation à Créteil l'Echat, le trafic est perturbé sur l'ensemble de la #Ligne8 #RATP"
2018-02-05 08:15:37,"Suite à un problème de signalisation à Créteil l'Echat, le trafic est perturbé sur l'ensemble de la #Ligne8 #RATP"
2018-02-05 08:03:34,"09:00, le trafic est perturbé sur la ligne (panne de signalisation) #RATP #Ligne8"
2018-02-05 07:49:31,"@RvShark @ClientsRATP Bonjour, Nous nous excusons pour la gêne occasionnée. Des annonces de perturbation vont être… https://t.co/iYHv6lWXbJ"
2018-02-05 07:11:01,"@Suzuca3 Bonjour, Le trafic est uniquement perturbé en direction de Balard.Nous vous confirmons que les trains roul… https://t.co/8vDY1My8Yh"
2018-02-05 06:57:36,"Suite à un problème de signalisation à Créteil l'Echat, le trafic est perturbé de Créteil l'Echat vers Balard sur la #Ligne8 #RATP"
2018-02-05 06:50:06,"@MyTransp @Jagged00 Bonjour, Nous ne sommes pas en mesure de vous donner une heure de rétablissement. Nos servies t… https://t.co/w8iuimOVGa"
2018-02-05 06:24:54,@Aleagrace Bonne journée également.Yvson
2018-02-05 06:16:20,"@Aleagrace Bonjour, Nous ne sommes pas en mesure de vous donner une heure de rétablissement et faisons le maximum p… https://t.co/r9oCFprIE8"
2018-02-05 06:10:42,"@barzek Bonjour, suite au problème de signalisation, nos services techniques RATP sont en cours d’intervention à Cr… https://t.co/UcJNx9UhtS"
2018-02-05 06:05:51,"@MyTransp @Jagged00 Bonjour, suite à une panne de signalisation, le trafic est perturbé de Créteil l'Echat vers Balard.Bonne journée.Yvson"
2018-02-05 05:49:57,"@Jagged00 La direction ""Créteil Pompadour"" n'existe pas sur la #Ligne8.En revanche, le trafic est normal en directi… https://t.co/FujYdFvHVL"
2018-02-05 05:44:21,"@Jagged00 Bonjour, Nous vous confirmons que suite à une panne de signalisation, le trafic est toujours perturbé de… https://t.co/VylowpacdN"
2018-02-05 04:34:34,"05:29, le trafic est perturbé de Creteil-L'Echat (Hopital Henri Mondor) vers Balard (panne de signalisation) #RATP #Ligne8"
2018-02-02 11:50:36,Retour à un trafic régulier sur l'ensemble de la #Ligne8 #RATP. Incident terminé.
2018-02-02 11:44:55,Fin d'incident à Faidherbe-Chal.. La rame est repartie en direction de Balard #Ligne8 #RATP
2018-02-02 11:39:35,"12:37, la rame stationne à Faidherbe-Chal. en dir. de Balard (malaise voyageur) #RATP #Ligne8"
2018-02-01 20:06:23,Fin d'incident à Pointe du Lac. La rame est repartie en direction de Balard #Ligne8 #RATP
2018-02-01 20:02:34,"20:58, la rame stationne sur la ligne (train en panne) #RATP #Ligne8"
2018-02-01 17:42:43,Retour à un trafic régulier sur l'ensemble de la #Ligne8 #RATP. Incident terminé.
2018-02-01 17:29:38,"[Bagage Oublié] 18:29, Fin d'incident, la station Bonne Nouvelle est rouverte au public #Ligne8 #Ligne9"
2018-02-01 17:16:47,"18:03, la station Bonne Nouvelle est fermée (bagage oublié) #RATP #Ligne8"
2018-02-01 17:13:17,"[Bagage Oublié] 18:13, En raison d'un bagage oublié sur la voie publique, la station Bonne Nouvelle est fermée au public #Ligne8 #Ligne9"
2018-02-01 16:25:45,"[Bagage oublié] 17:24, Fin d'incident à Balard. Le trafic reprend progressivement sur l'ensemble de la #Ligne8 #RATP"
2018-02-01 16:23:43,"@charonsamuel Bonsoir, nous avons actuellement un bagage oublié à Balard. L'équipe de déminage est sur place en cou… https://t.co/IXQOmO3hC0"
2018-02-01 16:20:54,"17:19, le trafic est interrompu entre Balard et La Motte-Piquet Grenelle. Reprise estimée à 18:00. (bagage oublié) #RATP #Ligne8"
2018-02-01 16:17:58,"@djbiggysmoke @djbiggysmoke Bonjour, nous avons un bagage oublié à Balard et les forces de l'ordre ainsi que les se… https://t.co/8BIEj45hPF"
2018-01-31 23:08:00,Retour à un trafic régulier sur l'ensemble de la ligne #RERB. Incident terminé.
2018-01-30 10:20:37,"Toute la journée, en raison de #CrueSeine, le trafic @RERC_SNCF est interrompu entre Javel et Paris Austerlitz / Av… https://t.co/ad52TsDeNc"
2018-01-29 09:13:52,Retour à un trafic régulier sur l'ensemble de la #Ligne8 #RATP. Incident terminé.
2018-01-29 08:23:46,"09:19, le trafic reprend progressivement (incident d'exploitation) #RATP #Ligne8"
2018-01-29 08:22:15,"Le trafic reprend progressivement sur la ligne, fin d'incident (incident d'exploitation). #Ligne8"
2018-01-29 08:16:31,"Suite à 1 incident d'exploitation, le trafic est interrompu entre Pointe du lac et Maisons-Alfort les Juilliottes.… https://t.co/EgNPo6TgvQ"
2018-01-29 05:09:07,"Toute la journée, en raison de #CrueSeine, le trafic @RERC_SNCF est interrompu entre Javel et Paris Austerlitz / Av… https://t.co/9lWdLPBpPl"
2018-01-28 17:07:06,Retour à un trafic régulier sur l'ensemble de la #Ligne8 #RATP.  Incident terminé.
2018-01-28 16:08:22,"17:04, le trafic est perturbé sur la ligne (bagage oublié) #RATP #Ligne8"
2018-01-28 16:04:17,"17:00, le trafic est interrompu entre Concorde et Republique. Reprise estimée à 17:45. (bagage oublié) #RATP #Ligne8"
2018-01-28 16:02:17,"16:55, le trafic est interrompu entre Concorde et Republique (bagage oublié) #RATP #Ligne8"
2018-01-28 10:15:46,Retour à un trafic régulier sur l'ensemble de la #Ligne8 #RATP. Incident terminé.
2018-01-28 10:07:31,"Incident terminé (malaise voyageur) la rame repart.
ViNi"
2018-01-28 10:04:16,"11:00, la rame stationne de Porte Doree vers Balard (malaise voyageur) #RATP #Ligne8"
2018-01-27 16:59:09,Retour à un trafic régulier sur l'ensemble de la #Ligne8 #RATP. Incident terminé.
2018-01-27 16:27:16,"17:24, le trafic reprend progressivement entre Pointe du Lac et Creteil-Universite (Personnes sur les voies) #RATP #Ligne8"
2018-01-27 16:23:16,"17:18, le trafic est interrompu entre Pointe du Lac et Creteil-Universite. Reprise estimée à 17:30. (Personnes sur les voies) #RATP #Ligne8"
2018-01-25 21:39:29,Retour à un trafic régulier sur l'ensemble de la #Ligne8 #RATP. Incident terminé.
2018-01-25 20:36:52,"21:34, le trafic est perturbé sur la ligne (accident grave de personne) #RATP #Ligne8"
2018-01-25 20:05:27,"20:41, le trafic reprend progressivement (accident grave de personne) #RATP #Ligne8"
2018-01-25 19:45:23,Le trafic reprend progressivement sur la #ligne8 #RATP
2018-01-25 19:30:31,"@Dubinho35 Bonjour, la ligne circule sur ce tronçon Fred"
2018-01-25 19:18:34,(accident grave de personne) Les pompiers sont sur place. #RATP #Ligne8
2018-01-25 19:14:57,"20:10, le trafic est interrompu entre Reuilly-Did. et Pointe du Lac. Reprise estimée à 21:00. (accident grave de personne) #RATP #Ligne8"
2018-01-25 19:03:18,"20:00, la rame stationne à Charenton-Ecoles en dir. de Pointe du Lac (accident grave de personne) #RATP #Ligne8"
2018-01-25 16:35:56,"En raison de #CrueSeine, le trafic @RERC_SNCF est interrompu entre Javel et  Austerlitz, entre Avenue Henri-Martin… https://t.co/xYnM8SrcdL"
2018-01-25 07:54:09,"@MathCrln Bonjour, le trafic est légèrement perturbé . Bonne journée.Tino.  #RATP #Ligne8"
2018-01-25 06:49:01,"07:43, le trafic est perturbé sur la ligne (panne de signalisation) #RATP #Ligne8"
2018-01-25 04:33:18,"Toute la journée, en raison de #CrueSeine, le trafic @RERC_SNCF est interrompu entre Javel et Paris Austerlitz, et… https://t.co/z4fCULhRTw"
2018-01-24 10:54:49,"@Jon_CC_R Bonjour, je vous confirme qu'il faut vous présenter à un guichet pour recherche (objet gardé entre 48h et… https://t.co/WIhkEwbBzO"
2018-01-24 10:22:36,"@Jon_CC_R Bonjour, vous pouvez vous rendre au niveau d'un guichet de la ligne et voir avec l'agent qui pourra vous… https://t.co/CUjcoJ7lsJ"
